{"composition_context":[{"candidate":"formula-01","char_end":1346,"char_start":9,"evidence_id":"composition-context:croscarmellose-sodium:formula-01","kind":"composition_context","measure":"croscarmellose_sodium","normalized_value_sha256":"9ef1735446f0bdde8aad2c60605365a731ae38afb86d97733353f3a74a16d87d","page":1,"quote_sha256":"fd6ca1db41398238dcc21ff978912ff886f094fe2679595fd1bcef4983d2ab0e","raw_cell_sha256":"d7bbac4c99c8e320a0f4afa81ea4358a3eb1a45430cb89bdd088f91435c8e5ea","raw_cell_text":"1,00","receipt_id":"croscarmellose-sodium:formula-01","record_id":"03d71cae3495ddf6","source_document_sha256":"01fe95607f4733e2b47a4c46f8dad5817d6014cc40f69a08631977c9d890cd8f","source_file":"inputs/trials/placeholder-probe/filled-public-mock-document-030826.docx","store_records_sha256":"9660f38d1234373c06aaee6e85c4e6c64478aa7ba1ab04546137c2428735b1fb","unit":"percent","value":1},{"candidate":"formula-02","char_end":1346,"char_start":9,"evidence_id":"composition-context:croscarmellose-sodium:formula-02","kind":"composition_context","measure":"croscarmellose_sodium","normalized_value_sha256":"161e4117614ffd2ac80fbf8806e65a04652d5e04962361b227c59a3f454bc11f","page":1,"quote_sha256":"fd6ca1db41398238dcc21ff978912ff886f094fe2679595fd1bcef4983d2ab0e","raw_cell_sha256":"34acb0d7ab158701e3110bb4042be874bf9c5e392f83e7b6012b260797525150","raw_cell_text":"3,00","receipt_id":"croscarmellose-sodium:formula-02","record_id":"03d71cae3495ddf6","source_document_sha256":"01fe95607f4733e2b47a4c46f8dad5817d6014cc40f69a08631977c9d890cd8f","source_file":"inputs/trials/placeholder-probe/filled-public-mock-document-030826.docx","store_records_sha256":"9660f38d1234373c06aaee6e85c4e6c64478aa7ba1ab04546137c2428735b1fb","unit":"percent","value":3},{"candidate":"formula-03","char_end":1346,"char_start":9,"evidence_id":"composition-context:croscarmellose-sodium:formula-03","kind":"composition_context","measure":"croscarmellose_sodium","normalized_value_sha256":"c1b40407baa5637ced0349d8b5f8957ede6c561b5c7aacce384bdf901be8a8b9","page":1,"quote_sha256":"fd6ca1db41398238dcc21ff978912ff886f094fe2679595fd1bcef4983d2ab0e","raw_cell_sha256":"8bbc3050f8ccf7836056f3185c11bb2bedbcb9a0d2a0904c7721cf779e1f2301","raw_cell_text":"5,00","receipt_id":"croscarmellose-sodium:formula-03","record_id":"03d71cae3495ddf6","source_document_sha256":"01fe95607f4733e2b47a4c46f8dad5817d6014cc40f69a08631977c9d890cd8f","source_file":"inputs/trials/placeholder-probe/filled-public-mock-document-030826.docx","store_records_sha256":"9660f38d1234373c06aaee6e85c4e6c64478aa7ba1ab04546137c2428735b1fb","unit":"percent","value":5}],"exact_cohort":["formula-01","formula-02","formula-03"],"observed_results":[{"candidate":"formula-01","char_end":2268,"char_start":1922,"evidence_id":"observed-result:assay:formula-01","kind":"observed_result","measure":"assay","normalized_value_sha256":"9d01e0a59c6cffe90f393d05277f838b9476c4efbcc83da101a6e40375dd0010","page":2,"quote_sha256":"2a4f9f618b889f479833edf6492d5d0005ea4718140971ae5194a05d14c42108","raw_cell_sha256":"46153be17853ad94dcf0600035f9c3f9c1f30a4b3082afeb4b23cec12abd168f","raw_cell_text":"100,31","receipt_id":"assay:formula-01","record_id":"b1e2267ee51496e9","source_document_sha256":"01fe95607f4733e2b47a4c46f8dad5817d6014cc40f69a08631977c9d890cd8f","source_file":"inputs/trials/placeholder-probe/filled-public-mock-document-030826.docx","statistic":"raw","store_records_sha256":"9660f38d1234373c06aaee6e85c4e6c64478aa7ba1ab04546137c2428735b1fb","unit":"percent","value":100.31},{"candidate":"formula-02","char_end":2268,"char_start":1922,"evidence_id":"observed-result:assay:formula-02","kind":"observed_result","measure":"assay","normalized_value_sha256":"dc335577a9adcccbb711d0894eee95d79920e14f8dc89b9294189dd89ac3bd07","page":2,"quote_sha256":"2a4f9f618b889f479833edf6492d5d0005ea4718140971ae5194a05d14c42108","raw_cell_sha256":"c8d9d75cde1471a443923b486bdf9cd6ab771bbe1ae0f270f9526abcc9fa6a62","raw_cell_text":"100,02","receipt_id":"assay:formula-02","record_id":"b1e2267ee51496e9","source_document_sha256":"01fe95607f4733e2b47a4c46f8dad5817d6014cc40f69a08631977c9d890cd8f","source_file":"inputs/trials/placeholder-probe/filled-public-mock-document-030826.docx","statistic":"raw","store_records_sha256":"9660f38d1234373c06aaee6e85c4e6c64478aa7ba1ab04546137c2428735b1fb","unit":"percent","value":100.02},{"candidate":"formula-03","char_end":2268,"char_start":1922,"evidence_id":"observed-result:assay:formula-03","kind":"observed_result","measure":"assay","normalized_value_sha256":"68816124e9758363ff3ed2b2f2e2536121197f9257030289f5fc157868cea3ca","page":2,"quote_sha256":"2a4f9f618b889f479833edf6492d5d0005ea4718140971ae5194a05d14c42108","raw_cell_sha256":"07ee3a1d8df963974f5e00ed5d1e070907421de66304ee044d3747f99c16b2c0","raw_cell_text":"99,99","receipt_id":"assay:formula-03","record_id":"b1e2267ee51496e9","source_document_sha256":"01fe95607f4733e2b47a4c46f8dad5817d6014cc40f69a08631977c9d890cd8f","source_file":"inputs/trials/placeholder-probe/filled-public-mock-document-030826.docx","statistic":"raw","store_records_sha256":"9660f38d1234373c06aaee6e85c4e6c64478aa7ba1ab04546137c2428735b1fb","unit":"percent","value":99.99},{"candidate":"formula-01","char_end":187,"char_start":0,"evidence_id":"observed-result:content-uniformity-av:formula-01","kind":"observed_result","measure":"content_uniformity_av","normalized_value_sha256":"8d6576972883c7940594ea755cc0ae58dcc3c0649c33c41ec4c2c330c47ae6e3","page":3,"quote_sha256":"9487a84e9a63bbd8f886f2f410a7e29930c31181ae6af8687de7673e9f8710f0","raw_cell_sha256":"dfa7d794632023493a74240d04737524cf62053486ea6dc5f07eb2c72e6c9715","raw_cell_text":"3,71","receipt_id":"content-uniformity-av:formula-01","record_id":"1c7e3d79e2bbaaf7","source_document_sha256":"01fe95607f4733e2b47a4c46f8dad5817d6014cc40f69a08631977c9d890cd8f","source_file":"inputs/trials/placeholder-probe/filled-public-mock-document-030826.docx","statistic":"average","store_records_sha256":"9660f38d1234373c06aaee6e85c4e6c64478aa7ba1ab04546137c2428735b1fb","unit":"percent","value":3.71},{"candidate":"formula-02","char_end":187,"char_start":0,"evidence_id":"observed-result:content-uniformity-av:formula-02","kind":"observed_result","measure":"content_uniformity_av","normalized_value_sha256":"1363d6f51f643e2373524e6f5001d0a8f701e46732b0e689f196579d9f87e8e2","page":3,"quote_sha256":"9487a84e9a63bbd8f886f2f410a7e29930c31181ae6af8687de7673e9f8710f0","raw_cell_sha256":"cc03899aaee92808e2bb1cfe198c7763290be4b63fe440450e4318b6b210923b","raw_cell_text":"2,79","receipt_id":"content-uniformity-av:formula-02","record_id":"1c7e3d79e2bbaaf7","source_document_sha256":"01fe95607f4733e2b47a4c46f8dad5817d6014cc40f69a08631977c9d890cd8f","source_file":"inputs/trials/placeholder-probe/filled-public-mock-document-030826.docx","statistic":"average","store_records_sha256":"9660f38d1234373c06aaee6e85c4e6c64478aa7ba1ab04546137c2428735b1fb","unit":"percent","value":2.79},{"candidate":"formula-03","char_end":187,"char_start":0,"evidence_id":"observed-result:content-uniformity-av:formula-03","kind":"observed_result","measure":"content_uniformity_av","normalized_value_sha256":"b94da1e83840a331cb88a68a7bb75c763456e98cfbb2ee7f2d3b2d5fa51f3506","page":3,"quote_sha256":"9487a84e9a63bbd8f886f2f410a7e29930c31181ae6af8687de7673e9f8710f0","raw_cell_sha256":"00268f57a720d33d82387522a1bf4361cbd7c8ed67ea3733de0e7fd86f0b7e65","raw_cell_text":"3,04","receipt_id":"content-uniformity-av:formula-03","record_id":"1c7e3d79e2bbaaf7","source_document_sha256":"01fe95607f4733e2b47a4c46f8dad5817d6014cc40f69a08631977c9d890cd8f","source_file":"inputs/trials/placeholder-probe/filled-public-mock-document-030826.docx","statistic":"average","store_records_sha256":"9660f38d1234373c06aaee6e85c4e6c64478aa7ba1ab04546137c2428735b1fb","unit":"percent","value":3.04},{"candidate":"formula-01","char_end":2799,"char_start":2330,"evidence_id":"observed-result:dissolution-max:formula-01","kind":"observed_result","measure":"dissolution_max","normalized_value_sha256":"3cba69d4f1e03aadea7cae51cb28280463a7f399f47e6ed9c465ee87624943f0","page":2,"quote_sha256":"22e8f8dde90f7a6e168c1d962d23581d8411fd69fcb040c3380f8d4dafd7bf33","raw_cell_sha256":"27685828169cf55a887521565990695a879dce482ada617cfc3384a912d4a131","raw_cell_text":"79,33","receipt_id":"dissolution-max:formula-01","record_id":"1af35f108df257cd","source_document_sha256":"01fe95607f4733e2b47a4c46f8dad5817d6014cc40f69a08631977c9d890cd8f","source_file":"inputs/trials/placeholder-probe/filled-public-mock-document-030826.docx","statistic":"maximum","store_records_sha256":"9660f38d1234373c06aaee6e85c4e6c64478aa7ba1ab04546137c2428735b1fb","unit":"percent","value":79.33},{"candidate":"formula-02","char_end":2799,"char_start":2330,"evidence_id":"observed-result:dissolution-max:formula-02","kind":"observed_result","measure":"dissolution_max","normalized_value_sha256":"f9c963cd3e028e1eb4840bb9139d470e20b7543a9d4562ad3884f7fee20f8cdf","page":2,"quote_sha256":"22e8f8dde90f7a6e168c1d962d23581d8411fd69fcb040c3380f8d4dafd7bf33","raw_cell_sha256":"e6b10ff7d220291d53d4307214cf39519e48aadd8899ef99018953cd63e26cf3","raw_cell_text":"87,67","receipt_id":"dissolution-max:formula-02","record_id":"1af35f108df257cd","source_document_sha256":"01fe95607f4733e2b47a4c46f8dad5817d6014cc40f69a08631977c9d890cd8f","source_file":"inputs/trials/placeholder-probe/filled-public-mock-document-030826.docx","statistic":"maximum","store_records_sha256":"9660f38d1234373c06aaee6e85c4e6c64478aa7ba1ab04546137c2428735b1fb","unit":"percent","value":87.67},{"candidate":"formula-03","char_end":2799,"char_start":2330,"evidence_id":"observed-result:dissolution-max:formula-03","kind":"observed_result","measure":"dissolution_max","normalized_value_sha256":"83f8a25f7d6d610516d80a3a2eb88e75c6c9b0dee74a6fb102aad5387b1f0e7f","page":2,"quote_sha256":"22e8f8dde90f7a6e168c1d962d23581d8411fd69fcb040c3380f8d4dafd7bf33","raw_cell_sha256":"0b438266819494fb0ec4a164fc6f8d74a85dca8f32ed7f730c7a26ddc4ab3301","raw_cell_text":"100,98","receipt_id":"dissolution